{
  "target_id": "longbridge/hk_combo",
  "description": "Synthetic retired profile fixture for validation tests; not a selectable target.",
  "github": {
    "repository": "QuantStrategyLab/LongBridgePlatform",
    "variable_scope": "repository"
  },
  "runtime_target": {
    "platform_id": "longbridge",
    "strategy_profile": "hk_equity_combo",
    "dry_run_only": true,
    "deployment_selector": "longbridge_sg",
    "account_selector": [
      "longbridge_sg"
    ],
    "account_scope": "HK",
    "service_name": "longbridge-quant-service",
    "execution_mode": "dry_run",
    "scheduler": {
      "timezone": "Asia/Hong_Kong",
      "main_time": "45 16 * * *",
      "probe_time": "35 9,16 * * *",
      "precheck_time": "45 9 * * *"
    }
  },
  "plugin_mounts_variable": "LONGBRIDGE_STRATEGY_PLUGIN_MOUNTS_JSON",
  "plugin_mounts": [],
  "extra_variables": {
    "DYNAMIC": "true",
    "REBALANCE_FREQUENCY": "monthly"
  }
}
