{
  "$schema": "../../../schemas/runtime-target.schema.json",
  "target_id": "firstrade/live",
  "description": "Example Firstrade repository-scoped deployment target.",
  "github": {
    "repository": "QuantStrategyLab/FirstradePlatform",
    "variable_scope": "repository"
  },
  "runtime_target": {
    "platform_id": "firstrade",
    "strategy_profile": "example_strategy_profile",
    "dry_run_only": false,
    "deployment_selector": "firstrade",
    "account_selector": ["firstrade"],
    "account_scope": "US",
    "service_name": "firstrade-quant-service",
    "execution_mode": "live"
  },
  "plugin_mounts_variable": "FIRSTRADE_STRATEGY_PLUGIN_MOUNTS_JSON",
  "plugin_mounts": [
    {
      "strategy": "example_strategy_profile",
      "plugin": "example_notification_plugin",
      "signal_path": "gs://example-bucket/strategy-artifacts/example_strategy_profile/plugins/example_notification_plugin/latest_signal.json",
      "enabled": true,
      "expected_mode": "shadow",
      "expected_schema_version": "example_notification_plugin.v1"
    }
  ],
  "extra_variables": {
    "FIRSTRADE_DRY_RUN_ONLY": "false"
  }
}
